{
  "$schema": "./schemas/site_metadata.schema.json",
  "site": {
    "title": "Jaden Bruha | Software Engineer",
    "description": "Jaden Bruha's Interactive portfolio with AI powered integrations.",
    "og_image": "/resources/og-image.png"
  },
  "theme": {
    "default": "system"
  },
  "deployment": {
    "backend_port": 8000,
    "frontend_port": 3003,
    "api_base_url_dev": "http://localhost:8000",
    "frontend_url_dev": "http://localhost:3003",
    "cors_origins": [
      "http://localhost:3003"
    ]
  },
  "repository": {
    "name": "res_web",
    "image_name": "res_web",
    "image_tag": "latest",
    "maintainer": "Jaden Bruha",
    "source": "https://github.com/bassnp/res_web"
  }
}
